layer	short_heading	long_heading	unit	direction	data_type	scale	display	rank	tooltip	conversion
crossings	impassability	Impassability Score		reverse	decimal	linear	not yet	5	The aquatic impassability score for the road-stream crossing (0 = Completely Passable, 1 = Impassable)	
crossings	bar_type	Crossing Type		reverse	text	categorical	no	17	Type of stream crossing (bridge, culvert, multiple culvert, etc.)	{"1":"Culvert","2":"Bridge","3":"Dam"}
crossings	jurisdiction	Road Jurisdiction		forward	text	categorical	no	25	Responsibility for road maintenance at crossing	{"0":"Unaccepted", "1":"Mass DOT", "2":"City/Town", "6":"State Park/Forest"}
crossings	nhs	National Highway System		forward	text	categorical	no	26	National Highway System status of road at crossing	{"0":"Not on NHS","1":"NHS-Interstate","14":"NHS-Other","15":"NHS-Arterial"}
crossings	drain_tot	Drainage Area	KM^2	forward	decimal	log	no	18	Drainage area (square kilometers) of all upstream reaches	
crossings	strkm_tot	Stream Length	KM	forward	decimal	log	no	19	Stream length (kilometers) of all upstream reaches	
crossings	upstr_bars	Structure Count		reverse	integer	log	no	20	Total number of upstream structures crossing the stream	
crossings	Slope_perc	Stream Slope	%	forward	decimal	log	no	21	The slope of the stream reach containing the crossing	
crossings	Q2_m3_s	Q2 Discharge	M^3/s	forward	decimal	log	no	22	The predicted two-year high discharge value determined using the Jacob's regime equation for gravel dominated stream beds	
crossings	w_W_m2_ST	Unit Stream Power	W/M	forward	decimal	log	no	23	The total energy exerted by the stream divided by the width of the stream determined using Q2 discharge and bankful width	
crossings	hydro_rof	Hydraulic Risk		reverse	decimal	linear	not yet	11	Risk of hydraulic failure for the stream crossing (0 = Low, 1 = High)	
crossings	struct_rof	Structural Risk		reverse	decimal	linear	not yet	12	Risk of structural failure for the stream crossing (0 = Low, 1 = High)	
crossings	geo_rof	Geomorphic Risk		reverse	decimal	linear	not yet	13	Risk of geomorphic failure for the stream crossing (0 = Low, 1 =  High)	
crossings	max_rof	Overall Risk		reverse	decimal	linear	yes	3	Maximum value for hydrologic, structural, and geomorphic risk of failure (0 = Low, 1 = High)	
crossings	ave_del	Average EMS Delay	Min.	reverse	decimal	log	not yet	14	Average traffic delay for emergency medical services throughout the watershed, if the road is closed due to crossing failure	
crossings	ave_aff_del	Average Affected EMS Delay	Min.	reverse	decimal	log	not yet	15	Average traffic delay for emergency medical services for trips using the crossing, if the road is closed due to crossing failure	
crossings	max_del	Maximum EMS Delay	Min.	reverse	decimal	log	not yet	16	Maximum traffic delay for emergency medical services, if the road is closed due to crossing failure	
crossings	int_eco_dis	Ecological Disruption		reverse	decimal	linear	yes	1	Integrated metric that combines overall connectivity restoration potential (for all streams) and Coldwater (16 C) restoration potential (for cold water streams)	
crossings	ln_comp_del	Overall EMS Delay		reverse	decimal	linear	yes	4	Integrated metric that combines frequency of use by EMS and potential delays for each trip (0 = Least affected, 1 = Most affected) (sum of all logistically converted trip delays transformed by the natural logarithm and scaled to most affected crossing)	
crossings	delta_scaled	Connectivity Loss		forward	decimal	linear	not yet	6	Loss of aquatic connectivity caused by crossing impassibility	
crossings	effect_scaled	Connectivity Restoration Potential		forward	decimal	linear	not yet	7	Potential for improved aquatic connectivity via crossing replacement (connectivity loss weighted by habitat quality)	
crossings	effect_scaled_16	Coldwater (16 C) Restoration Potential		forward	decimal	linear	not yet	8	Potential for improved aquatic connectivity of coldwater streams (below 16 C average summer temperature) via crossing replacement (connectivity loss weighted by habitat quality) 0 = Low, 1 = High	
crossings	effect_scaled_18	Coldwater (18 C) Restoration Potential		forward	decimal	linear	not yet	9	Potential for improved aquatic connectivity of coldwater streams (below 18 C average summer temperature) via crossing replacement (connectivity loss weighted by habitat quality)  0 = Low, 1 = High	
crossings	effect_scaled_20	Coldwater (20 C) Restoration Potential		forward	decimal	linear	not yet	10	Potential for improved aquatic connectivity of coldwater streams (below 20 C average summer temperature) via crossing replacement (connectivity loss weighted by habitat quality)  0 = Low, 1 = High	
crossings	Observed_Date	Assessment Date		forward	date	linear	no	24	Date the crossing was field assessed (NA indicates crossing has not been field assessed)	
crossings	trans_vuln	Transportation Vulnerability		reverse	decimal	linear	yes	2	Transportation system vulnerability score that combines the Overall EMS delay score (criticality) and Overall Risk of Failure score (risk)	
crossings	cross_prior	Crossing Prioritization		reverse	decimal	linear	yes	0	Crossing prioritization score that combines the maximum value of the Ecological Disruption and Transportation Vulnerability scores (0 = Low, 1 = High)	
crossings	featureid	Feature ID		forward	integer	linear	never	29	The unique identifier of the catchment in which the stream crossing is located	
crossings	unique_id	Unique ID		forward	integer	linear	never	28	The unique identifier of the stream crossing	
crossings	crossing_id	Crossing ID		forward	text	linear	never	27	The NAACC XY identifier (culverts and bridges) or TNC identifier (dams) of the stream crossing	
catchments	agriculture	Agriculture	%	reverse	decimal	log	yes	3	Percentage of the catchment used for agriculture	
catchments	elevation	Elevation	M	forward	decimal	linear	yes	0	Average elevation (meters) of the catchment	
catchments	forest	Forest Cover	%	forward	decimal	linear	yes	2	Percentage of the catchment covered with forest	
catchments	impervious	Impervious Surface	%	reverse	decimal	log	yes	5	Percentage of the catchment covered with impervious surface	
catchments	slope_pcnt	Catchment Slope	%	forward	decimal	log	yes	1	Average hillside slope (percent) of the catchment	
catchments	water	Water Cover	%	reverse	decimal	log	yes	4	Percentage of the catchment covered with water	
catchments	featureid	Feature ID		forward	integer	linear	never	6	The unique identifier of the catchment	
streams	str_order	Stream Order		forward	text	categorical	yes	0	Stream order (Strahler method) of stream reach	{"1":"1","2":"2","3":"3","4":"4","5":"5","6":"6"}
streams	occ_cur	Trout Habitat Suitability		reverse	decimal	linear	yes	1	Probability that the stream reach is suitable for brook trout	
streams	T_mean_sum	Stream Temperature	C	forward	decimal	linear	yes	2	Average predicted summer temperature (degrees C) of stream reach	
streams	T_inertia	Stream Temperature Resistance		reverse	decimal	linear	yes	3	Predicted resistance of stream temperature to changes in air temperature (0 = Low, 1 = High)	
streams	featureid	Feature ID		forward	integer	linear	never	7	The unique identifier of the catchment (in which the stream centroid is located)	
streams	unique_id	Unique ID		forward	integer	linear	never	6	The unique identifier of the stream	
streams	from_node	From Node		forward	integer	linear	never	4	The unique identifier of the first point of the stream reach	
streams	to_node	To Node		forward	integer	linear	never	5	The unique identifier of the last point of the stream reach	
political	state	State								
political	county	County								
political	town	Town								
political	dot_district	DOT District								
political	huc12_name	HUC 12								
political	ej_criteria	Environmental Justice								
